{"api_key_env":"TYPESAFE_API_KEY","buffer_capacity":3,"business_attribute_source":"synthetic_controlled_v1","business_mode":"evaluate_only","candidate_backend":"e2_original_v1","confidence_policy":"record_only","display_order_seed":20261029,"endpoint":"https://api.typesafe.ai/v1/systemone","evaluation_version":"business_trajectory_v1","execution_version":"physical_commit_v1","experiment_binding":"f08fcdbe82301f1d239ca16d75b2be263fe28a7150fd8534f8ed3c9f8e77a2fa","experiment_protocol":"jev_j3_physical_business_eval_v1","fallback":"none","feature_version":"features_facts_v2","joint_candidates_max":48,"max_memory_cards":0,"max_request_bytes":96000,"max_retries":0,"memory_mode":"none","model":"jev-1.14.0","per_object_top_k":16,"policy_source":"public_parser","probability_sum_validation":"strict_or_2dp_rounding_interval_v1","probability_tolerance":1e-05,"prompt_version":"jev_business_eval_en_v2","provider":"typesafe","response_max_bytes":1000000,"selectable_pool":"physical_feasible","selector":"jev_choice","timeout_s":30.0,"version":"jev_direct_choice_v2"}
